{
  "$schema": "https://json-schema.org/draft/2020-12/schema",
  "$id": "https://sourceos.local/schemas/ledger/event.schema.json",
  "title": "LedgerEvent",
  "type": "object",
  "required": [
    "event_id",
    "ts",
    "type",
    "actor",
    "payload_hash",
    "policy_hash",
    "prev_hash",
    "hash"
  ],
  "description": "Append-only ledger event; grant_id and evidence_refs are optional governance overlays.",
  "properties": {
    "event_id": {
      "type": "string",
      "minLength": 8
    },
    "ts": {
      "type": "string",
      "format": "date-time"
    },
    "type": {
      "type": "string",
      "enum": [
        "A2A_HELLO",
        "A2A_ATTEST",
        "A2A_DISCOVER",
        "A2A_NEGOTIATE",
        "A2A_GRANT",
        "A2A_REVOKE",
        "MCP_CALL",
        "MCP_RESULT",
        "WF_VALIDATE",
        "WF_PLACE",
        "WF_DISPATCH",
        "WF_RESULT",
        "WF_REPLAY",
        "WF_COMPENSATE",
        "WF_APPROVAL_REQUEST",
        "WF_APPROVAL_DECISION",
        "OP_TOOL_INVOKE",
        "OP_MSG_SEND",
        "OP_TASK_DELEGATE",
        "OP_GRANT_VALIDATE",
        "OP_GRANT_REVOKE",
        "OP_DIAG_EXPORT"
      ]
    },
    "actor": {
      "type": "object",
      "required": [
        "spiffe_id"
      ],
      "properties": {
        "spiffe_id": {
          "type": "string",
          "minLength": 1
        },
        "aum_digest": {
          "type": "string",
          "pattern": "^sha256:[a-f0-9]{64}$"
        }
      },
      "additionalProperties": false
    },
    "target": {
      "type": "object",
      "properties": {
        "kind": {
          "type": "string",
          "enum": [
            "mcp_tool",
            "a2a_skill",
            "deployment",
            "runner_action"
          ]
        },
        "spiffe_id": {
          "type": "string"
        },
        "capability_ref": {
          "type": "string"
        },
        "capability_digest": {
          "type": "string",
          "pattern": "^sha256:[a-f0-9]{64}$"
        },
        "server": {
          "type": "string"
        },
        "tool": {
          "type": "string"
        },
        "agent_id": {
          "type": "string"
        },
        "skill": {
          "type": "string"
        },
        "deployment_id": {
          "type": "string"
        },
        "operation": {
          "type": "string"
        },
        "executor_ref": {
          "type": "string"
        }
      },
      "additionalProperties": false
    },
    "payload_hash": {
      "type": "string",
      "pattern": "^sha256:[a-f0-9]{64}$"
    },
    "policy_hash": {
      "type": "string",
      "pattern": "^sha256:[a-f0-9]{64}$"
    },
    "decision": {
      "type": "object",
      "properties": {
        "allow": {
          "type": "boolean"
        },
        "reason": {
          "type": "string"
        }
      },
      "additionalProperties": false
    },
    "redaction": {
      "type": "object",
      "properties": {
        "applied": {
          "type": "boolean"
        },
        "rules": {
          "type": "array",
          "items": {
            "type": "string"
          }
        }
      },
      "additionalProperties": false
    },
    "prev_hash": {
      "type": "string",
      "pattern": "^sha256:[a-f0-9]{64}$"
    },
    "hash": {
      "type": "string",
      "pattern": "^sha256:[a-f0-9]{64}$"
    },
    "signatures": {
      "type": "array",
      "items": {
        "type": "object",
        "required": [
          "kind",
          "sig"
        ],
        "properties": {
          "kind": {
            "type": "string",
            "enum": [
              "service",
              "human"
            ]
          },
          "spiffe_id": {
            "type": "string"
          },
          "sig": {
            "type": "string",
            "minLength": 16
          }
        },
        "additionalProperties": false
      },
      "default": []
    },
    "grant_id": {
      "type": "string",
      "minLength": 8,
      "description": "Optional reference to the Grant that authorized this ledger event."
    },
    "trust_boundary_id": {
      "type": "string",
      "minLength": 8,
      "description": "Optional reference to the TrustBoundary at which this operation was evaluated."
    },
    "authority_envelope_id": {
      "type": "string",
      "minLength": 8,
      "description": "Optional reference to the DelegatedAuthority envelope that scoped this operation."
    },
    "evidence_refs": {
      "$ref": "https://socioprophet.dev/schema/governance/runtime_evidence_refs.schema.json"
    }
  },
  "additionalProperties": false
}
