{
  "event_id": "evt_12345678",
  "ts": "2026-01-07T00:00:01Z",
  "type": "A2A_GRANT",
  "actor": { "spiffe_id": "spiffe://sourceos/policyarbiter", "aum_digest": "sha256:2222222222222222222222222222222222222222222222222222222222222222" },
  "target": { "spiffe_id": "spiffe://sourceos/inception", "server": "fs.introspect", "tool": "hash" },
  "payload_hash": "sha256:3333333333333333333333333333333333333333333333333333333333333333",
  "policy_hash": "sha256:4444444444444444444444444444444444444444444444444444444444444444",
  "prev_hash": "sha256:5555555555555555555555555555555555555555555555555555555555555555",
  "hash": "sha256:6666666666666666666666666666666666666666666666666666666666666666",
  "decision": { "allow": true, "reason": "grant issued" },
  "redaction": { "applied": false, "rules": [] },
  "signatures": [{ "kind": "service", "spiffe_id": "spiffe://sourceos/policyarbiter", "sig": "MEUCIQDfakefakefakefakefakefakefakefakefakefakefakefake" }],
  "grant_id": "grant_12345678",
  "evidence_refs": {
    "event_ir_ref": "worm://event-ir/e1",
    "event_ir_hash": "sha256:1111111111111111111111111111111111111111111111111111111111111111",
    "semantic_proof_ref": "worm://proofs/prime/p1",
    "semantic_proof_hash": "sha256:2222222222222222222222222222222222222222222222222222222222222222",
    "hdt_decision_ref": "worm://hdt/omega/d1",
    "hdt_decision_hash": "sha256:3333333333333333333333333333333333333333333333333333333333333333",
    "attestation_bundle_ref": "worm://attest/a1",
    "attestation_bundle_hash": "sha256:4444444444444444444444444444444444444444444444444444444444444444"
  }
}
